1415	n	I don't like it when mathematicians who know much more than I do can't express themselves explicitly.	Ich mag es nicht, wenn Mathematiker, die viel mehr wissen als ich, sich nicht klar ausdrücken können.	Ich mag es nicht, wenn Mathematiker, die viel mehr wissen als ich, sich nicht deutlich ausdrücken können.	Ich mag es nicht, wenn Mathematiker, die viel mehr als ich wissen, sich nicht genau ausdrücken können.	I don't like it when mathematicians, who know much more than I do, can't express themselves clearly.	I don't like it when mathematicians, who know much more than I do, can't express themselves clearly.	YES	YES
1502	n	I wish I could care more about my grades but it seems that, at a certain point of my life, I decided they wouldn't be so important anymore.	Ich wünschte, ich könnte mir mehr um meine Noten Sorgen machen, aber es scheint, dass ich an einem bestimmten Punkt in meinem Leben entschieden habe, dass sie nicht mehr so wichtig sein würden.	Ich wünschte, ich könnte mehr Wert auf meine Noten legen, aber es scheint, dass ich an einem bestimmten Punkt in meinem Leben entschieden habe, dass sie nicht mehr so wichtig sind.	Ich wünschte, ich könnte mir mehr aus Noten machen, aber scheinbar habe ich an einem gewissen Punkt in meinem Leben entschieden, dass es nicht mehr so wichtig sei.	I wish I could place more value on my grades, but it seems that at a certain point in my life, I decided that they are not so important anymore.	I wish I could place more value on my grades, but it seems that at a certain point in my life, I decided that they are not so important anymore.	YES	YES
1623	n	The mandatory character of schooling is rarely analyzed in the multitude of works dedicated to the study of the various ways to develop within children the desire to learn.	Der verpflichtende Charakter der Schulausbildung wird selten in der Vielzahl von Arbeiten analysiert, die der Erforschung der verschiedenen Wege gewidmet sind, bei Kindern den Wunsch zu lernen zu entwickeln.	Der verpflichtende Charakter der Schulausbildung wird selten in der Vielzahl von Arbeiten analysiert, die der Untersuchung der verschiedenen Wege gewidmet sind, um bei Kindern den Wunsch zu lernen zu entwickeln.	Die Verpflichtung zum Schulbesuch wird selten analysiert in der Vielzahl der Werke, die den mannigfaltigen Arten gewidmet sind, bei Kindern den Wunsch zu lernen zu entwickeln.	The mandatory nature of school education is rarely analyzed in the multitude of studies dedicated to exploring the various ways to develop a desire to learn in children.	The mandatory nature of school education is rarely analyzed in the multitude of studies dedicated to exploring the various ways to develop a desire to learn in children.	YES	YES
1684	n	If you don't want to put on sunscreen, that's your problem. Just don't come complaining to me when you get a sunburn.	Wenn du keine Sonnencreme auftragen willst, ist das dein Problem. Beschwere dich aber nicht bei mir, wenn du einen Sonnenbrand bekommst.	Wenn du keine Sonnencreme auftragen willst, ist das dein Problem. Beschwere dich einfach nicht bei mir, wenn du einen Sonnenbrand bekommst.	Wenn du dich nicht mit Sonnencreme eincremen willst, ist das deine Sache. Aber beschwer' dich später nicht bei mir, wenn du Sonnenbrand hast.	If you don't want to apply sunscreen, that's your problem. Just don't complain to me if you get sunburned.	If you don't want to apply sunscreen, that's your problem. Just don't complain to me if you get sunburned.	YES	YES
1695	n	Mathematics is the part of science you could continue to do if you woke up tomorrow and discovered the universe was gone.	Mathematik ist der Teil der Wissenschaft, den du weiterhin betreiben könntest, wenn du morgen aufwachen würdest und entdecken würdest, dass das Universum verschwunden ist.	Mathematik ist der Teil der Wissenschaft, den Sie weiterhin betreiben könnten, wenn Sie morgen aufwachen und entdecken, dass das Universum verschwunden ist.	Die Mathematik ist der Teil der Wissenschaft, den man weiter betreiben könnte, wenn man morgen aufwachen würde und entdecken würde, dass das Universum weg ist.	Mathematics is the part of science that you could continue to pursue if you woke up tomorrow and discovered that the universe had disappeared.	Mathematics is the part of science that you could continue to pursue if you woke up tomorrow and discovered that the universe had disappeared.	YES	YES
1725	n	If you're tired, why don't you go to sleep? "Because if I go to sleep now I will wake up too early."	Wenn du müde bist, warum gehst du dann nicht schlafen? Weil ich, wenn ich jetzt schlafen gehe, zu früh aufwachen werde.	Wenn du müde bist, warum gehst du nicht schlafen? Weil ich, wenn ich jetzt schlafe, zu früh aufwachen werde.	Wenn du müde bist, wieso gehst du nicht schlafen? "Weil ich zu früh aufwachen werde, wenn ich jetzt schlafen gehe."	If you're tired, why don't you go to sleep? Because if I sleep now, I will wake up too early.	If you're tired, why don't you go to sleep? Because if I sleep now, I will wake up too early.	YES	YES
1728	e	When the body is touched, receptors in the skin send messages to the brain causing the release of chemicals such as endorphins.	Wenn der Körper berührt wird, senden Rezeptoren in der Haut Nachrichten an das Gehirn, was zur Freisetzung von Chemikalien wie Endorphinen führt.	Wenn der Körper berührt wird, senden Rezeptoren in der Haut Nachrichten an das Gehirn, was zur Freisetzung von Chemikalien wie Endorphinen führt.	Wenn der Körper berührt wird, schicken Rezeptoren in der Haut Nachrichten zum Gehirn und verursachen die Ausschüttung von chemischen Stoffen wie Endorphinen.	When the body is touched, receptors in the skin send messages to the brain, leading to the release of chemicals such as endorphins.	When the body is touched, receptors in the skin send messages to the brain, leading to the release of chemicals such as endorphins.	YES	YES
1735	e	The French government has launched an online game that challenges taxpayers to balance the national budget.	Die französische Regierung hat ein Online-Spiel gestartet, das die Steuerzahler herausfordert, den nationalen Haushalt auszugleichen.	Die französische Regierung hat ein Online-Spiel gestartet, das die Steuerzahler herausfordert, den nationalen Haushalt auszugleichen.	Die französische Regierung hat ein Online-Spiel auf den Markt gebracht, das Steuerzahler auffordert, den Staatshaushalt auszugleichen.	The French government has launched an online game that challenges taxpayers to balance the national budget.	The French government has launched an online game that challenges taxpayers to balance the national budget.	YES	YES
1794	n	Mathematicians are like French people: whatever you tell them they translate it into their own language and turn it into something totally different.	Mathematiker sind wie Franzosen: Was auch immer Sie ihnen sagen, sie übersetzen es in ihre eigene Sprache und verwandeln es in etwas völlig anderes.	Mathematiker sind wie Franzosen: Was auch immer Sie ihnen erzählen, sie übersetzen es in ihre eigene Sprache und verwandeln es in etwas völlig anderes.	Die Mathematiker sind eine Art Franzosen: redet man zu ihnen, so übersetzen sie es in ihre Sprache, und dann ist es alsobald ganz etwas anders.	Mathematicians are like the French: whatever you tell them, they translate it into their own language and turn it into something completely different.	Mathematicians are like the French: whatever you tell them, they translate it into their own language and turn it into something completely different.	YES	YES
1795	n	An expert is someone who knows some of the worst mistakes that can be made in his field, and how to avoid them.	Ein Experte ist jemand, der einige der schlimmsten Fehler kennt, die in seinem Fachgebiet gemacht werden können, und weiß, wie man sie vermeidet.	Ein Experte ist jemand, der einige der schlimmsten Fehler kennt, die in seinem Bereich gemacht werden können, und wie man sie vermeidet.	Ein Experte ist jemand, der die schlimmsten Fehler kennt, die in seinem Gebiet gemacht werden können und weiß, wie man sie vermeidet.	An expert is someone who knows some of the worst mistakes that can be made in his field, and how to avoid them.	An expert is someone who knows some of the worst mistakes that can be made in his field, and how to avoid them.	YES	YES
1799	e	Nowadays we want our children to make their own decisions, but we expect those decisions to please us.	Heutzutage wollen wir, dass unsere Kinder ihre eigenen Entscheidungen treffen, aber wir erwarten, dass diese Entscheidungen uns gefallen.	Heutzutage wollen wir, dass unsere Kinder ihre eigenen Entscheidungen treffen, aber wir erwarten, dass diese Entscheidungen uns gefallen.	Heutzutage wollen wir, dass unsere Kinder ihre eigenen Entscheidungen treffen, aber wir erwarten, dass uns diese Entscheidungen passen.	Nowadays, we want our children to make their own decisions, but we expect those decisions to please us.	Nowadays, we want our children to make their own decisions, but we expect those decisions to please us.	YES	YES
1815	n	When I ask people what they regret most about high school, they nearly all say the same thing: that they wasted so much time.	Wenn ich Leute frage, was sie am meisten an der Highschool bereuen, sagen fast alle das Gleiche: dass sie so viel Zeit verschwendet haben.	Wenn ich Leute frage, was sie am meisten an der High School bereuen, sagen fast alle das Gleiche: dass sie so viel Zeit verschwendet haben.	Wenn ich Leute frage, was sie in Bezug aufs Gymnasium am meisten bedauern, sagen fast alle das Gleiche: dass sie so viel Zeit verschwendet haben.	When I ask people what they regret most about high school, almost everyone says the same thing: that they wasted so much time.	When I ask people what they regret most about high school, almost everyone says the same thing: that they wasted so much time.	YES	YES
1828	n	At the age of six he had learned to use the typewriter and told the teacher that he did not need to learn to write by hand.	Im Alter von sechs Jahren hatte er gelernt, die Schreibmaschine zu benutzen und sagte dem Lehrer, dass er nicht lernen müsse, mit der Hand zu schreiben.	Im Alter von sechs Jahren hatte er gelernt, die Schreibmaschine zu benutzen und sagte dem Lehrer, dass er nicht lernen müsse, von Hand zu schreiben.	Im Alter von sechs Jahren hatte er gelernt, eine Schreibmaschine zu bedienen und er erklärte dem Lehrer, dass er nicht lernen müsste, mit der Hand zu schreiben.	At the age of six, he had learned to use the typewriter and told the teacher that he did not need to learn to write by hand.	At the age of six, he had learned to use the typewriter and told the teacher that he did not need to learn to write by hand.	YES	YES
1842	e	If you know that something unpleasant will happen, that you will go to the dentist for example, or to France, then that is not good.	Wenn Sie wissen, dass etwas Unangenehmes passieren wird, dass Sie zum Beispiel zum Zahnarzt gehen oder nach Frankreich, dann ist das nicht gut.	Wenn Sie wissen, dass etwas Unangenehmes passieren wird, dass Sie zum Beispiel zum Zahnarzt gehen oder nach Frankreich, dann ist das nicht gut.	Wenn man weiß, dass etwas Unangenehmes geschehen wird, dass man zum Beispiel zum Zahnarzt oder nach Frankreich gehen wird, dann ist das nicht gut.	If you know that something unpleasant is going to happen, like for example going to the dentist or to France, then that's not good.	If you know that something unpleasant is going to happen, like for example going to the dentist or to France, then that's not good.	YES	YES
1844	e	Prime numbers are like life; they are completely logical, but impossible to find the rules for, even if you spend all your time thinking about it.	Primzahlen sind wie das Leben; sie sind völlig logisch, aber es ist unmöglich, die Regeln dafür zu finden, selbst wenn man seine ganze Zeit damit verbringt, darüber nachzudenken.	Primzahlen sind wie das Leben; sie sind völlig logisch, aber es ist unmöglich, die Regeln dafür zu finden, selbst wenn man seine ganze Zeit damit verbringt, darüber nachzudenken.	Primzahlen sind wie das Leben, sie sind völlig logisch, aber es ist unmöglich, Regeln für sie zu finden, selbst wenn man seine ganze Zeit dem Nachdenken darüber widmet.	Prime numbers are like life; they are completely logical, but it is impossible to find the rules for them, even if one spends all their time thinking about it.	Prime numbers are like life; they are completely logical, but it is impossible to find the rules for them, even if one spends all their time thinking about it.	YES	YES
1845	n	If you raise an eyebrow, it can mean "I want to have sex with you", but also "I find that what you just said is completely idiotic."	Wenn du eine Augenbraue hochziehst, kann das bedeuten Ich möchte mit dir schlafen, aber auch Ich finde, was du gerade gesagt hast, ist völlig idiotisch.	Wenn Sie eine Augenbraue hochziehen, kann das bedeuten Ich möchte mit dir schlafen, aber auch Ich finde, was du gerade gesagt hast, ist völlig idiotisch.	Wenn man eine Augenbraue hochzieht, kann das bedeuten "Ich habe Lust, mit dir Sex zu haben", aber auch "Ich finde, dass das, was du gerade gesagt hast, vollkommen idiotisch ist."	If you raise an eyebrow, it can mean I want to sleep with you, but also I think what you just said is completely idiotic.	If you raise an eyebrow, it can mean I want to sleep with you, but also I think what you just said is completely idiotic.	YES	YES
1856	e	There are people in the world so hungry, that God cannot appear to them except in the form of bread.	Es gibt Menschen auf der Welt, die so hungrig sind, dass Gott ihnen nur in Form von Brot erscheinen kann.	Es gibt Menschen auf der Welt, die so hungrig sind, dass Gott ihnen nur in Form von Brot erscheinen kann.	Es gibt Leute auf der Welt, die so hungrig sind, dass Gott ihnen nicht erscheinen kann, außer in Form von Brot.	There are people in the world who are so hungry that God can only appear to them in the form of bread.	There are people in the world who are so hungry that God can only appear to them in the form of bread.	YES	YES
1903	n	Denying she was an anarchist, Katja maintained she wished only to make changes in our government, not to destroy it.	Sie bestritt, eine Anarchistin zu sein, Katja behauptete, sie wolle nur Veränderungen in unserer Regierung herbeiführen, nicht sie zerstören.	Sie bestritt, eine Anarchistin zu sein, Katja behauptete, sie wolle nur Änderungen in unserer Regierung vornehmen, nicht sie zerstören.	Katja leugnete, dass sie eine Anarchistin war, indem sie behauptete, dass sie nur wünschte, Veränderung in unserer Regierung zu machen, nicht, sie zu zerstören.	She denied being an anarchist, Katja claimed, she only wanted to make changes in our government, not destroy it.	She denied being an anarchist, Katja claimed, she only wanted to make changes in our government, not destroy it.	YES	YES
1904	n	Blindness is responsible for a staggering toll of poor health, suffering, and loss of dignity and diminution in the quality of lives of people worldwide.	Blindheit ist verantwortlich für eine erschütternde Anzahl von Gesundheitsproblemen, Leiden und Verlust von Würde und Verminderung der Lebensqualität von Menschen weltweit.	Blindheit ist verantwortlich für eine erschütternde Bilanz an schlechter Gesundheit, Leiden und Verlust von Würde und Verminderung der Lebensqualität von Menschen weltweit.	Blindheit ist verantwortlich für eine erschütternde Anzahl von Opfern schlechter Gesundheit, Leiden und Verlust von Würde und Verminderung der Lebensqualität von Menschen in der ganzen Welt.	Blindness is responsible for a staggering record of poor health, suffering, and loss of dignity, and reduction in the quality of life of people worldwide.	Blindness is responsible for a staggering record of poor health, suffering, and loss of dignity, and reduction in the quality of life of people worldwide.	YES	YES
1907	n	David has a keen interest in aesthetics — the qualities that make a painting, sculpture, musical composition, or poem pleasing to the eye, ear, or mind.	David hat ein ausgeprägtes Interesse an Ästhetik - die Qualitäten, die ein Gemälde, eine Skulptur, eine musikalische Komposition oder ein Gedicht für das Auge, Ohr oder den Verstand ansprechend machen.	David hat ein ausgeprägtes Interesse an Ästhetik - den Eigenschaften, die ein Gemälde, eine Skulptur, eine musikalische Komposition oder ein Gedicht für das Auge, Ohr oder den Verstand angenehm machen.	David hat ein leidenschaftliches Interesse an Ästhetik - den Eigenschaften, die ein Gemälde, eine Skulptur, eine musikalische Komposition oder ein Gedicht Auge, Ohr oder Geist gefallen lassen.	David has a pronounced interest in aesthetics - the properties that make a painting, a sculpture, a musical composition, or a poem pleasing to the eye, ear, or mind.	David has a pronounced interest in aesthetics - the properties that make a painting, a sculpture, a musical composition, or a poem pleasing to the eye, ear, or mind.	YES	YES
1908	n	Despite Trang's constant affirmations of love, Spenser is still afraid someday she will fall out of love with him.	Trotz Trangs ständigen Liebesbekundungen hat Spenser immer noch Angst, dass sie eines Tages aufhören könnte, ihn zu lieben.	Trotz Trangs ständigen Liebesbekundungen hat Spenser immer noch Angst, dass sie eines Tages nicht mehr in ihn verliebt sein wird.	Trotz Trangs regelmäßigen Liebesbeteuerungen hat Spenser immer noch Angst, dass sie irgendwann aufhören wird, ihn zu lieben.	Despite Trang's constant declarations of love, Spenser is still afraid that one day she will no longer be in love with him.	Despite Trang's constant declarations of love, Spenser is still afraid that one day she will no longer be in love with him.	YES	YES
1918	n	The discrepancy between the stories of the two parties involved in the accident was so great that the authorities had a hard time deciding which side was telling the truth.	Die Diskrepanz zwischen den Geschichten der beiden am Unfall beteiligten Parteien war so groß, dass die Behörden Schwierigkeiten hatten zu entscheiden, welche Seite die Wahrheit sagte.	Die Diskrepanz zwischen den Geschichten der beiden an dem Unfall beteiligten Parteien war so groß, dass die Behörden Schwierigkeiten hatten zu entscheiden, welche Seite die Wahrheit erzählte.	Die Unstimmigkeit zwischen den Geschichten der zwei Unfallbeteiligten war so groß, dass die Behörden Schwierigkeiten hatten, zu entscheiden, welche Seite die Wahrheit erzählte.	The discrepancy between the stories of the two parties involved in the accident was so great that the authorities had difficulty deciding which side was telling the truth.	The discrepancy between the stories of the two parties involved in the accident was so great that the authorities had difficulty deciding which side was telling the truth.	YES	YES
1931	n	Spenser's sarcastic and joking remarks are often misinterpreted as signs of ambivalence and often taken too seriously.	Spensers sarkastische und scherzhafte Bemerkungen werden oft falsch als Zeichen von Ambivalenz interpretiert und oft zu ernst genommen.	Spensers sarkastische und scherzhafte Bemerkungen werden oft als Zeichen von Ambivalenz fehlinterpretiert und oft zu ernst genommen.	Spensers sarkastische und scherzhafte Bemerkungen werden oft als Zeichen von Doppelwertigkeit missinterpretiert und zu ernst genommen.	Spenser's sarcastic and joking remarks are often misinterpreted as signs of ambivalence and often taken too seriously.	Spenser's sarcastic and joking remarks are often misinterpreted as signs of ambivalence and often taken too seriously.	YES	YES
1934	n	The convicted drug dealer was willing to comply with the authorities to have his death sentence reduced to a life sentence.	Der verurteilte Drogenhändler war bereit, mit den Behörden zusammenzuarbeiten, um seine Todesstrafe in eine lebenslange Haftstrafe umzuwandeln.	Der verurteilte Drogenhändler war bereit, mit den Behörden zu kooperieren, um seine Todesstrafe in eine lebenslange Haftstrafe umzuwandeln.	Der verurteilte Drogendealer war gewillt, sich den Behörden zu fügen, um seine Todesstrafe zu einer lebenslänglichen Freiheitsstrafe zu vermindern.	The convicted drug dealer was ready to cooperate with the authorities to convert his death sentence into a life sentence.	The convicted drug dealer was ready to cooperate with the authorities to convert his death sentence into a life sentence.	YES	YES
1935	n	I consider the Jehovah's witnesses who knock on my door all the time to be no different from religious zealots trying to force their beliefs on me.	Ich betrachte die Zeugen Jehovas, die ständig an meiner Tür klopfen, als nicht anders als religiöse Fanatiker, die versuchen, mir ihre Überzeugungen aufzuzwingen.	Ich betrachte die Zeugen Jehovas, die ständig an meine Tür klopfen, als nicht anders als religiöse Eiferer, die versuchen, mir ihre Überzeugungen aufzuzwingen.	Ich denke, dass die Zeugen Jehovas, die immer an meine Türe klopfen, keinen Unterschied machen zu den religiösen Fanatikern, die mir deren Glauben versuchen aufzudrängen.	I regard the Jehovah's Witnesses, who constantly knock on my door, as nothing more than religious zealots trying to impose their beliefs on me.	I regard the Jehovah's Witnesses, who constantly knock on my door, as nothing more than religious zealots trying to impose their beliefs on me.	YES	YES
1936	n	The war on Iraq is a volatile subject of political debate; any wrong word and a heated argument could spark.	Der Krieg im Irak ist ein brisantes Thema der politischen Debatte; ein falsches Wort und eine hitzige Diskussion könnte entfachen.	Der Krieg im Irak ist ein brisantes Thema der politischen Debatte; jedes falsche Wort könnte eine hitzige Diskussion entfachen.	Der Irakkrieg ist ein unberechenbares Thema der politischen Debatte; ein falsches Wort und ein Streit könnte sich entzünden.	The war in Iraq is a volatile topic in political debate; every wrong word could ignite a heated discussion.	The war in Iraq is a volatile topic in political debate; every wrong word could ignite a heated discussion.	NO. The German translation is not completely correct. The phrase "eine hitzige Diskussion könnte entfachen" is not a proper sentence in German. A better translation would be: "Der Krieg im Irak ist ein brisantes Thema der politischen Debatte; ein falsches Wort und ein hitziger Streit könnte entfachen."	YES
1937	e	My next door neighbor is a virtuoso whose skills with the piano have earned him a name among music experts.	Mein Nachbar von nebenan ist ein Virtuose, dessen Fähigkeiten am Klavier ihm einen Namen unter Musikexperten eingebracht haben.	Mein Nachbar von nebenan ist ein Virtuose, dessen Fähigkeiten am Klavier ihm einen Namen unter Musikexperten eingebracht haben.	Mein nächster Türnachbar ist ein Virtuose, dessen Geschick am Klavier ihm einen Namen unter den Musikexperten eingebracht hat.	My neighbor next door is a virtuoso, whose piano skills have earned him a name among music experts.	My neighbor next door is a virtuoso, whose piano skills have earned him a name among music experts.	YES	YES
1942	e	With the heirless king going crazy and royal family poisoned, the general of the army finally had his chance to usurp the throne.	Mit dem erbenlosen König, der verrückt wurde, und der vergifteten königlichen Familie, hatte der General der Armee endlich seine Chance, den Thron zu usurpieren.	Mit dem erbenlosen König, der verrückt wurde, und der vergifteten königlichen Familie, hatte der General der Armee endlich seine Chance, den Thron zu usurpieren.	Dass der erbenlose König wahnsinnig und die königliche Familie vergiftet wurde, verschaffte dem Armeegeneral die Gelegenheit, den Thron an sich zu reißen.	With the heirless king who went mad, and the poisoned royal family, the army general finally had his chance to usurp the throne.	With the heirless king who went mad, and the poisoned royal family, the army general finally had his chance to usurp the throne.	YES	YES
1943	e	The recent scandals involving altar boys and religious leaders have undermined the faith people have in the Church.	Die jüngsten Skandale, die Ministranten und religiöse Führer betreffen, haben den Glauben der Menschen an die Kirche untergraben.	Die jüngsten Skandale, die Ministranten und religiöse Führer betreffen, haben den Glauben der Menschen an die Kirche untergraben.	Die neulichen Skandale, in die Messdiener und religiöse Oberhäupter verwickelt waren, haben den Glauben, den die Leute in die Kirche haben, unterminiert.	The recent scandals involving altar servers and religious leaders have undermined people's faith in the church.	The recent scandals involving altar servers and religious leaders have undermined people's faith in the church.	YES	YES
1944	e	As the plane was approaching turbulence, the pilot asked the passengers aboard the plane to fasten their seat belts.	Als das Flugzeug Turbulenzen näher kam, bat der Pilot die Passagiere an Bord, ihre Sicherheitsgurte anzulegen.	Als das Flugzeug Turbulenzen näher kam, bat der Pilot die Passagiere an Bord, ihre Sicherheitsgurte anzulegen.	Als sich das Flugzeug Turbulenzen näherte, bat der Pilot die Passagiere an Bord des Flugzeugs, ihre Sitzgurte zu schließen.	As the airplane approached turbulence, the pilot asked the passengers on board to fasten their seat belts.	As the airplane approached turbulence, the pilot asked the passengers on board to fasten their seat belts.	YES	YES
