2132	n	The rooms in this hotel are really very bad at muffling sounds. I can hear my neighbor chewing his gum!	Die Zimmer in diesem Hotel sind wirklich sehr schlecht schallisoliert. Ich kann meinen Nachbarn sein Kaugummi kauen hören!	Die Zimmer in diesem Hotel sind wirklich sehr schlecht darin, Geräusche zu dämpfen. Ich kann meinen Nachbarn sein Kaugummi kauen hören!	Die Zimmer dieses Hotels sind wirklich sehr schlecht schallgedämpft. Ich kann meinen Nachbarn seinen Kaugummi kauen hören!	The rooms in this hotel are really poorly soundproofed. I can hear my neighbor chewing his gum!	The rooms in this hotel are really bad at dampening noise. I can hear my neighbor chewing his gum!	YES	YES
2165	n	I guess my view on friendship is pretty bleak because I've never really had to rely on anyone for anything.	Ich nehme an, meine Sicht auf Freundschaft ist ziemlich düster, weil ich noch nie wirklich auf jemanden für irgendetwas angewiesen war.	Ich schätze, meine Sicht auf Freundschaft ist ziemlich düster, weil ich noch nie wirklich auf jemanden für irgendetwas angewiesen war.	Vermutlich ist meine Ansicht von Freundschaft recht trostlos, denn ich musste mich nie ernsthaft wegen irgendetwas auf irgendjemanden verlassen.	I assume my view on friendship is quite bleak, because I've never really had to rely on anyone for anything.	I guess my view on friendship is quite bleak, because I have never really relied on anyone for anything.	YES	YES
2209	e	The seven questions that an engineer has to ask himself are: who, what, when, where, why, how and how much.	Die sieben Fragen, die sich ein Ingenieur stellen muss, sind: wer, was, wann, wo, warum, wie und wie viel.	Die sieben Fragen, die sich ein Ingenieur stellen muss, sind: wer, was, wann, wo, warum, wie und wie viel.	Die sieben Fragen, die sich ein Ingenieur stellen muss, sind: wer, was, wann, wo, warum, wie und wie viel.	The seven questions an engineer must ask himself are: who, what, when, where, why, how, and how much.	The seven questions an engineer must ask himself are: who, what, when, where, why, how, and how much.	YES	YES
2252	n	Why did you wake me up to tell me something that big? Now, I'll never be able to concentrate on my work!	Warum hast du mich geweckt, um mir etwas so Wichtiges zu sagen? Jetzt werde ich mich nie wieder auf meine Arbeit konzentrieren können!	Warum hast du mich geweckt, um mir so etwas Wichtiges zu sagen? Jetzt werde ich mich nie wieder auf meine Arbeit konzentrieren können!	Warum hast du mich aufgeweckt, um mir etwas so wichtiges zu erzählen? Jetzt werde ich mich nie auf meine Arbeit konzentrieren können!	Why did you wake me up to tell me something so important? Now, I will never be able to concentrate on my work again!	Why have you woken me up to tell me something so important? Now I will never be able to concentrate on my work again!	YES	YES
2257	e	Sometimes Spenser cares so much about Trang that he leads her to believe he is being overprotective.	Manchmal kümmert sich Spenser so sehr um Trang, dass er sie glauben lässt, er sei überfürsorglich.	Manchmal kümmert sich Spenser so sehr um Trang, dass er sie glauben lässt, er sei überfürsorglich.	Manchmal sorgt sich Spenser so sehr um Trang, dass er sie dazu bringt, zu glauben, dass er überfürsorglich ist.	Sometimes Spenser cares so much about Trang that he makes her believe he is overprotective.	Sometimes Spenser cares so much about Trang that he makes her believe he is overprotective.	YES	YES
2259	e	The most perfidious way of harming a cause consists of defending it deliberately with faulty arguments.	Die perfideste Art, einer Sache zu schaden, besteht darin, sie absichtlich mit fehlerhaften Argumenten zu verteidigen.	Die perfideste Art, einer Sache zu schaden, besteht darin, sie absichtlich mit fehlerhaften Argumenten zu verteidigen.	Die perfideste Art einer Sache zu schaden ist, sie absichtlich mit fehlerhaften Gründen verteidigen.	The most perfidious way to harm a cause is to deliberately defend it with flawed arguments.	The most perfidious way to harm a cause is to deliberately defend it with flawed arguments.	YES	YES
2261	e	As he sits in the dark, typing away at his computer, he hears the sound of morning birds chirping away and realizes he has been up all night - but the insomniac still refuses to sleep.	Während er im Dunkeln sitzt und an seinem Computer tippt, hört er das Zwitschern der Morgenvögel und erkennt, dass er die ganze Nacht wach war - aber der Schlaflose weigert sich immer noch zu schlafen.	Während er im Dunkeln sitzt und an seinem Computer tippt, hört er das Zwitschern der Morgenvögel und erkennt, dass er die ganze Nacht wach war - aber der Schlaflose weigert sich immer noch zu schlafen.		As he sits in the dark typing on his computer, he hears the chirping of the morning birds and realizes that he has been awake all night - but the insomniac still refuses to sleep.	As he sits in the dark typing on his computer, he hears the chirping of the morning birds and realizes that he has been awake all night - but the insomniac still refuses to sleep.	YES	YES
2265	n	The second half of a man's life is made up of nothing but the habits he has acquired during the first half.	Die zweite Hälfte des Lebens eines Mannes besteht aus nichts anderem als den Gewohnheiten, die er in der ersten Hälfte erworben hat.	Die zweite Hälfte eines Mannes Leben besteht nur aus den Gewohnheiten, die er in der ersten Hälfte erworben hat.	Die zweite Hälfte des Lebens eines Menschen besteht nur aus den Gewohnheiten, die er sich während der ersten Hälfte angeeignet hat.	The second half of a man's life consists of nothing but the habits he acquired in the first half.	The second half of a man's life consists only of the habits he acquired in the first half.	YES	YES
2267	n	Girls are more likely than boys to be malnourished, suffer poverty, face violence and be refused an education, according to a new report.	Mädchen sind laut einem neuen Bericht eher als Jungen unterernährt, leiden unter Armut, sind Gewalt ausgesetzt und wird eine Bildung verweigert.	Mädchen sind laut einem neuen Bericht eher als Jungen unterernährt, leiden unter Armut, sind Gewalt ausgesetzt und werden einer Bildung verweigert.	Gemäß eines neuen Berichts ist für Mädchen die Wahrscheinlichkeit höher als für Jungen, unter schlechter Ernährung, Armut und Gewalt zu leiden und eine Ausbildung verweigert zu bekommen.	Girls are more likely to be malnourished, suffer from poverty, face violence, and be denied an education than boys, according to a new report.	Girls are more likely to be malnourished than boys, suffer from poverty, are exposed to violence, and are denied education, according to a new report.	YES	YES
2269	e	On May 18, a young Japanese couple was arrested after their one-year-old baby was found wrapped in a plastic bag and dumped in a gutter.	Am 18. Mai wurde ein junges japanisches Paar verhaftet, nachdem ihr einjähriges Baby in einer Plastiktüte eingewickelt und in einem Abflusskanal gefunden wurde.	Am 18. Mai wurde ein junges japanisches Paar verhaftet, nachdem ihr einjähriges Baby in einer Plastiktüte eingewickelt und in einem Abflusskanal gefunden wurde.		On May 18, a young Japanese couple was arrested after their one-year-old baby was found wrapped in a plastic bag and left in a drainage canal.	On May 18, a young Japanese couple was arrested after their one-year-old baby was found wrapped in a plastic bag and left in a drainage canal.	YES	YES
2270	e	We are haunted by an ideal life, and it is because we have within us the beginning and the possibility for it.	Wir werden von einem idealen Leben verfolgt, und das liegt daran, dass wir in uns den Anfang und die Möglichkeit dafür haben.	Wir werden von einem idealen Leben verfolgt, und das liegt daran, dass wir in uns den Anfang und die Möglichkeit dafür haben.	Wir jagen einem idealen Leben hinterher, weil wir in uns den Anfang und die Möglichkeit dazu haben.	We are pursued by an ideal life, and that's because we have the beginning and the possibility for it within us.	We are pursued by an ideal life, and that's because we have the beginning and the possibility for it within us.	YES	YES
2272	e	The scientific theory I like the best is that the rings of Saturn are composed entirely of lost luggage.	Die wissenschaftliche Theorie, die mir am besten gefällt, ist, dass die Ringe des Saturns vollständig aus verlorenem Gepäck bestehen.	Die wissenschaftliche Theorie, die mir am besten gefällt, ist, dass die Ringe des Saturns vollständig aus verlorenem Gepäck bestehen.	Die wissenschaftliche Theorie, die mir am besten gefällt, ist, dass die Ringe des Saturn vollständig aus verlorenem Gepäck bestehen.	The scientific theory I like the most is that the rings of Saturn are entirely made up of lost luggage.	The scientific theory I like the most is that the rings of Saturn are entirely made up of lost luggage.	YES	YES
2280	n	Never lose sight of the importance of a beautiful sunrise, or watching your kids sleep, or the smell of rain. It's often the small things that really matter in life.	Verliere niemals aus den Augen, wie wichtig ein schöner Sonnenaufgang ist, oder deine Kinder beim Schlafen zu beobachten, oder der Geruch von Regen. Oft sind es die kleinen Dinge, die im Leben wirklich zählen.	Verliere niemals aus den Augen, wie wichtig ein schöner Sonnenaufgang ist, oder deine schlafenden Kinder zu beobachten, oder der Geruch von Regen. Oft sind es die kleinen Dinge, die im Leben wirklich zählen.	Vergesst nie, was es bedeutet, einen wundervollen Sonnenaufgang zu sehen, seine Kinder beim Schlafen zu beobachten oder den Regen zu riechen. Es sind oft die kleinen Dinge, die wirklich wichtig sind im Leben.	Never lose sight of how important a beautiful sunrise is, or watching your children sleep, or the smell of rain. Often, it's the little things that really count in life.	Never lose sight of how important a beautiful sunrise is, or watching your sleeping children, or the smell of rain. Often, it's the little things that really count in life.	YES	YES
2290	n	Advertising may be described as the science of arresting the human intelligence long enough to get money from it.	Werbung kann als die Wissenschaft beschrieben werden, die menschliche Intelligenz lange genug zu fesseln, um Geld daraus zu ziehen.	Werbung kann als die Wissenschaft beschrieben werden, die menschliche Intelligenz lange genug zu fesseln, um Geld daraus zu bekommen.	Werbung könnte man beschreiben als die Wissenschaft davon, wie man die menschliche Intelligenz lange genug ausschaltet, um Geld daraus zu gewinnen.	Advertising can be described as the science of captivating human intelligence long enough to extract money from it.	Advertising can be described as the science of captivating human intelligence long enough to make money from it.	YES	YES
2294	n	That's the thing about people who think they hate computers. What they really hate is lousy programmers.	Das ist das Ding bei Leuten, die glauben, sie hassen Computer. Was sie wirklich hassen, sind schlechte Programmierer.	Das ist das Ding bei Leuten, die denken, sie hassen Computer. Was sie wirklich hassen, sind miserable Programmierer.	Die Sache mit Leuten, die meinen, Computer zu hassen, ist diese: in Wirklichkeit hassen sie lausige Programmierer.	That's the thing about people who think they hate computers. What they really hate are bad programmers.	That's the thing about people who think they hate computers. What they really hate are lousy programmers.	YES	YES
2295	e	It is not the strongest of the species that survives, not the most intelligent, but the one most responsive to change.	Es ist nicht die stärkste Spezies, die überlebt, auch nicht die intelligenteste, sondern diejenige, die am besten auf Veränderungen reagiert.	Es ist nicht die stärkste Spezies, die überlebt, auch nicht die intelligenteste, sondern diejenige, die am besten auf Veränderungen reagiert.	Es ist nicht die stärkste Spezies, die überlebt, auch nicht die intelligenteste, sondern die reaktionsfähigste gegenüber Veränderungen.	It is not the strongest species that survives, nor the most intelligent, but the one that responds best to change.	It is not the strongest species that survives, nor the most intelligent, but the one that responds best to change.	YES	YES
2342	n	If you see a man approaching you with the obvious intention of doing you good, you should run for your life.	Wenn Sie einen Mann auf sich zukommen sehen mit der offensichtlichen Absicht, Ihnen Gutes zu tun, sollten Sie um Ihr Leben rennen.	Wenn Sie einen Mann auf sich zukommen sehen, der offensichtlich die Absicht hat, Ihnen Gutes zu tun, sollten Sie um Ihr Leben rennen.	Wenn Sie einen Mann auf sich zukommen sehen in der offenkundigen Absicht, Ihnen etwas Gutes zu tun, dann sollten Sie um Ihr Leben rennen.	If you see a man approaching you with the obvious intention of doing you good, you should run for your life.	If you see a man approaching you who obviously intends to do you good, you should run for your life.	YES	YES
2363	e	In business today, too many executives spend money they haven't earned, to buy things they don't need, to impress people they don't even like.	Im Geschäftsleben geben heute zu viele Führungskräfte Geld aus, das sie nicht verdient haben, um Dinge zu kaufen, die sie nicht brauchen, um Menschen zu beeindrucken, die sie nicht einmal mögen.	Im Geschäftsleben geben heute zu viele Führungskräfte Geld aus, das sie nicht verdient haben, um Dinge zu kaufen, die sie nicht brauchen, um Menschen zu beeindrucken, die sie nicht einmal mögen.		In the business world today, too many executives spend money they haven't earned, to buy things they don't need, to impress people they don't even like.	In the business world today, too many executives spend money they haven't earned, to buy things they don't need, to impress people they don't even like.	YES	YES
2382	n	At this stage there is still not a clear energy policy for bringing decentralised power to rural areas.	In diesem Stadium gibt es immer noch keine klare Energiepolitik zur Bereitstellung dezentralisierter Energie für ländliche Gebiete.	In diesem Stadium gibt es immer noch keine klare Energiepolitik für die Bereitstellung dezentraler Energie in ländlichen Gebieten.		At this stage, there is still no clear energy policy for providing decentralized energy to rural areas.	At this stage, there is still no clear energy policy for the provision of decentralized energy in rural areas.	YES	YES
2385	n	Why are you telling me about hippos all of the sudden? I don't see the connection between that and your twelve red goldfishes.	Warum erzählst du mir plötzlich von Flusspferden? Ich sehe den Zusammenhang zwischen dem und deinen zwölf roten Goldfischen nicht.	Warum erzählst du mir plötzlich von Flusspferden? Ich sehe die Verbindung zwischen dem und deinen zwölf roten Goldfischen nicht.	Wieso erzählst du mir plötzlich von Nilpferden? Ich sehe den Zusammenhang zwischen ihnen und deinen zwölf Goldfischen nicht.	Why are you suddenly telling me about hippos? I don't see the connection between that and your twelve red goldfish.	Why are you suddenly telling me about hippopotamuses? I don't see the connection between that and your twelve red goldfish.	YES	YES
2477	n	Every man's work, whether it be literature or music or a picture or architecture or anything else, is always a portrait of himself.	Jedes Werk eines Mannes, ob es Literatur oder Musik oder ein Bild oder Architektur oder irgendetwas anderes ist, ist immer ein Porträt von ihm selbst.	Jedes Werk eines Mannes, sei es Literatur oder Musik oder ein Bild oder Architektur oder irgendetwas anderes, ist immer ein Porträt von ihm selbst.	Das Schaffen eines jeden Menschen, ob in Literatur, Musik, Malerei, Architektur oder beliebigem anderem Bereiche, ist immer ein Bildnis seiner selbst.	Every work of a man, whether it is literature or music or a picture or architecture or anything else, is always a portrait of himself.	Every work of a man, be it literature or music or a picture or architecture or anything else, is always a portrait of himself.	YES	YES
