1946	n	Though his stay in Europe was transient, Spenser felt he had learned much more about interactions with other people from traveling than he did at college.	Obwohl sein Aufenthalt in Europa nur von kurzer Dauer war, fühlte Spenser, dass er durch das Reisen viel mehr über den Umgang mit anderen Menschen gelernt hatte als auf dem College.	Obwohl sein Aufenthalt in Europa nur vorübergehend war, fühlte Spenser, dass er durch das Reisen viel mehr über den Umgang mit anderen Menschen gelernt hatte als im College.	Obwohl sein Aufenthalt in Europa kurzlebig war, fühlte Spenser, dass er vom Reisen mehr über Beziehungen mit anderen Menschen gelernt hatte, als er es im College getan hatte.	Although his stay in Europe was only temporary, Spenser felt that he had learned much more about dealing with other people through traveling than he had in college.	Although his stay in Europe was only temporary, Spenser felt that he had learned much more about dealing with other people through traveling than he had in college.	YES	YES
1950	e	If Spenser doesn't keep adding and translating sentences, the other contributors will surely surpass him.	Wenn Spenser nicht weiterhin Sätze hinzufügt und übersetzt, werden die anderen Mitwirkenden ihn sicherlich überholen.	Wenn Spenser nicht weiterhin Sätze hinzufügt und übersetzt, werden die anderen Mitwirkenden ihn sicherlich überholen.	Wenn Spenser nicht weiterhin Sätze hinzufügt und übersetzt, werden die anderen Mitwirkenden ihn sicher übertreffen.	If Spenser does not continue to add and translate sentences, the other contributors will surely surpass him.	If Spenser does not continue to add and translate sentences, the other contributors will surely surpass him.	YES	YES
1952	e	His essay gave only a superficial analysis of the problem, so it was a real surprise to him when he got the highest grade in the class.	Sein Aufsatz lieferte nur eine oberflächliche Analyse des Problems, daher war es eine echte Überraschung für ihn, als er die höchste Note in der Klasse bekam.	Sein Aufsatz lieferte nur eine oberflächliche Analyse des Problems, daher war es eine echte Überraschung für ihn, als er die höchste Note in der Klasse bekam.	Sein Aufsatz gab nur eine oberflächliche Analyse des Problems, daher war es eine richtige Überraschung für ihn, als er die beste Note in der Klasse bekam.	His essay provided only a superficial analysis of the problem, so it was a real surprise for him when he received the highest grade in the class.	His essay provided only a superficial analysis of the problem, so it was a real surprise for him when he received the highest grade in the class.	YES	YES
1954	e	Professors should explain everything in detail, not be succinct and always tell students to go home and read their books.	Professoren sollten alles im Detail erklären, nicht knapp sein und den Studenten immer sagen, sie sollen nach Hause gehen und ihre Bücher lesen.	Professoren sollten alles im Detail erklären, nicht knapp sein und den Studenten immer sagen, sie sollen nach Hause gehen und ihre Bücher lesen.	Professoren sollten alles im Detail erklären, nicht knapp sein und immer ihren Studenten auftragen, heimzugehen und ihre Bücher zu lesen.	Professors should explain everything in detail, not be brief, and always tell students to go home and read their books.	Professors should explain everything in detail, not be brief, and always tell students to go home and read their books.	YES	YES
1957	n	The people who come on the Maury Povich show often make pretentious claims about their lovers cheating on them.	Die Leute, die in die Maury Povich Show kommen, machen oft hochtrabende Behauptungen darüber, dass ihre Liebhaber sie betrügen.	Die Leute, die in die Maury Povich Show kommen, machen oft anmaßende Behauptungen darüber, dass ihre Liebhaber sie betrügen.		The people who come on the Maury Povich Show often make presumptuous claims about their lovers cheating on them.	The people who come on the Maury Povich Show often make presumptuous claims about their lovers cheating on them.	YES	YES
1958	e	It is a prevalent belief, according to a nationwide poll in the United States, that Muslims are linked with terrorism.	Es ist eine weit verbreitete Überzeugung, laut einer landesweiten Umfrage in den Vereinigten Staaten, dass Muslime mit Terrorismus in Verbindung gebracht werden.	Es ist eine weit verbreitete Überzeugung, laut einer landesweiten Umfrage in den Vereinigten Staaten, dass Muslime mit Terrorismus in Verbindung gebracht werden.	Laut einer landesweiten Umfrage in den USA ist es ein geläufiger Glaube, dass Moslems mit Terrorismus verbunden sind.	Laut einer landesweiten Umfrage ist es in den USA ein geläufiger Glaube, Muslime hätten etwas mit Terrorismus zu tun.	Laut einer landesweiten Umfrage ist es in den USA ein geläufiger Glaube, Muslime hätten etwas mit Terrorismus zu tun.	YES	YES
1959	e	My roommate is prodigal when it comes to spending money on movies; he buys them the day they're released, regardless of price.	Mein Mitbewohner ist verschwenderisch, wenn es um das Ausgeben von Geld für Filme geht; er kauft sie am Tag ihrer Veröffentlichung, unabhängig vom Preis.	Mein Mitbewohner ist verschwenderisch, wenn es um das Ausgeben von Geld für Filme geht; er kauft sie am Tag ihrer Veröffentlichung, unabhängig vom Preis.	Mein Zimmerkamerad ist verschwenderisch, was das Geldausgeben für Filme betrifft; er kauft sie am Tag, wo sie herauskommen, ohne Rücksicht auf den Preis.	My roommate is extravagant when it comes to spending money on movies; he buys them on the day of their release, regardless of the price.	My roommate is extravagant when it comes to spending money on movies; he buys them on the day of their release, regardless of the price.	YES	YES
1960	n	The profane language used on network television makes many parents with young children not want to subscribe to cable.	Die vulgäre Sprache, die im Netzwerkfernsehen verwendet wird, lässt viele Eltern mit kleinen Kindern nicht zum Kabelanschluss abonnieren wollen.	Die unflätige Sprache, die im Netzwerkfernsehen verwendet wird, lässt viele Eltern mit kleinen Kindern nicht an Kabelabonnements interessiert sein.	Wegen der lästerlichen Sprache im Network-Fernsehen wollen viele Eltern junger Kinder kein Kabelfernsehen.	The vulgar language used on network television makes many parents with young children uninterested in cable subscriptions.	The vulgar language used on network television makes many parents with young children uninterested in cable subscriptions.	NO. The German translation is not completely correct. A better translation would be: "Die vulgäre Sprache, die im Netzwerkfernsehen verwendet wird, veranlasst viele Eltern mit kleinen Kindern dazu, kein Kabelfernsehen abonnieren zu wollen."	NO. The German translation is not completely accurate. A better translation would be: "Die unflätige Sprache, die im Netzwerkfernsehen verwendet wird, veranlasst viele Eltern mit kleinen Kindern dazu, kein Kabelabo zu wollen."
1962	e	Food and drink were served in such profusion at the wedding that the bride and groom began to wonder if they should not have invited more guests.	Essen und Trinken wurden bei der Hochzeit in solch einem Überfluss serviert, dass sich die Braut und der Bräutigam zu fragen begannen, ob sie nicht mehr Gäste hätten einladen sollen.	Essen und Trinken wurden bei der Hochzeit in solch einem Überfluss serviert, dass sich die Braut und der Bräutigam zu fragen begannen, ob sie nicht mehr Gäste hätten einladen sollen.	Essen und Trinken wurden bei der Hochzeit in solch einem Überfluss serviert, dass Braut und Bräutigam begannen, sich zu fragen, ob sie nicht mehr Gäste einladen hätten sollen.	Food and drink were served at the wedding in such abundance that the bride and groom began to wonder if they should have invited more guests.	Food and drink were served at the wedding in such abundance that the bride and groom began to wonder if they should have invited more guests.	YES	YES
1965	e	Blind people sometimes develop a compensatory ability to sense the proximity of objects around them.	Blinde Menschen entwickeln manchmal eine kompensatorische Fähigkeit, die Nähe von Objekten um sie herum zu spüren.	Blinde Menschen entwickeln manchmal eine kompensatorische Fähigkeit, die Nähe von Objekten um sie herum zu spüren.	Blinde entwickeln manchmal eine ausgleichende Fähigkeit, die Nähe der Gegenstände um sie herum zu spüren.	Blind people sometimes develop a compensatory ability to sense the proximity of objects around them.	Blind people sometimes develop a compensatory ability to sense the proximity of objects around them.	YES	YES
1967	n	When both girls told John they had feelings for him, he was in a quandary as to which girl he should be with.	Als beide Mädchen John sagten, dass sie Gefühle für ihn hätten, war er unschlüssig, mit welchem Mädchen er zusammen sein sollte.	Als beide Mädchen John sagten, dass sie Gefühle für ihn hätten, war er in einer Zwickmühle, mit welchem Mädchen er zusammen sein sollte.	Als beide Mädchen John sagten, dass sie Gefühle für ihn hatten, wusste der nicht, mit welchem Mädchen er zusammen sein sollte.	When both girls told John that they had feelings for him, he was in a dilemma about which girl he should be with.	When both girls told John that they had feelings for him, he was in a dilemma about which girl he should be with.	YES	YES
1968	n	Even now, many years after the Cold War, there is still much rancor between the Russians and the Germans, especially in areas once occupied by the Soviet Union.	Auch jetzt, viele Jahre nach dem Kalten Krieg, besteht noch viel Groll zwischen den Russen und den Deutschen, insbesondere in Gebieten, die einst von der Sowjetunion besetzt waren.	Auch jetzt, viele Jahre nach dem Kalten Krieg, gibt es immer noch viel Groll zwischen den Russen und den Deutschen, insbesondere in Gebieten, die einst von der Sowjetunion besetzt waren.	Sogar jetzt, viele Jahre nach dem Kalten Krieg, ist immer noch viel Verbitterung zwischen Russen und Deutschen, besonders in Gebieten, die einst von der Sowjetunion besetzt waren.	Even now, many years after the Cold War, there is still much resentment between the Russians and the Germans, especially in areas that were once occupied by the Soviet Union.	Even now, many years after the Cold War, there is still much resentment between the Russians and the Germans, especially in areas that were once occupied by the Soviet Union.	YES	YES
1969	n	The defense lawyer was confident that he would be able to answer the prosecutor's arguments in his rebuttal.	Der Verteidigungsanwalt war sich sicher, dass er in der Lage sein würde, auf die Argumente des Staatsanwalts in seiner Erwiderung zu antworten.	Der Verteidigungsanwalt war zuversichtlich, dass er in seiner Erwiderung die Argumente des Staatsanwalts beantworten könnte.		The defense attorney was confident that he could address the prosecutor's arguments in his response.	The defense attorney was confident that he could address the prosecutor's arguments in his response.	YES	YES
1971	e	Teachers must get tired of rectifying the same mistakes over and over again in their students' papers.	Lehrer müssen es satt haben, immer wieder die gleichen Fehler in den Arbeiten ihrer Schüler zu korrigieren.	Lehrer müssen es satt haben, immer wieder die gleichen Fehler in den Arbeiten ihrer Schüler zu korrigieren.	Lehrer müssen es leid sein, wieder und wieder die gleichen Fehler in den Arbeiten ihrer Schüler zu korrigieren.	Teachers must be fed up with constantly correcting the same mistakes in their students' work.	Teachers must be fed up with constantly correcting the same mistakes in their students' work.	YES	YES
1976	n	Shocked by the events of September 11th, politicians all over the world condemned the terrorists for their reprehensible deed.	Schockiert von den Ereignissen des 11. September verurteilten Politiker auf der ganzen Welt die Terroristen für ihre verwerfliche Tat.	Erschüttert von den Ereignissen des 11. September verurteilten Politiker auf der ganzen Welt die Terroristen für ihre verwerfliche Tat.	Schockiert durch die Ereignisse des 11. September, verurteilten Politiker in der ganzen Welt die Terroristen für ihre verwerfliche Tat.	Shaken by the events of September 11th, politicians around the world condemned the terrorists for their reprehensible act.	Shaken by the events of September 11th, politicians around the world condemned the terrorists for their reprehensible act.	YES	YES
1982	e	To win his audience, the speaker resorted to using rhetorical techniques he learned from his communication courses.	Um sein Publikum zu gewinnen, griff der Redner auf rhetorische Techniken zurück, die er in seinen Kommunikationskursen gelernt hatte.	Um sein Publikum zu gewinnen, griff der Redner auf rhetorische Techniken zurück, die er in seinen Kommunikationskursen gelernt hatte.	Um sein Publikum für sich zu gewinnen, griff der Redner auf die Anwendung rhetorischer Techniken zurück, die er in seinen Kommunikationskursen gelernt hatte.	To win over his audience, the speaker resorted to rhetorical techniques that he had learned in his communication courses.	To win over his audience, the speaker resorted to rhetorical techniques that he had learned in his communication courses.	YES	YES
1983	e	His father would never sanction his engagement to a girl who did not share the same religious beliefs as their family.	Sein Vater würde niemals seine Verlobung mit einem Mädchen billigen, das nicht die gleichen religiösen Überzeugungen wie ihre Familie teilt.	Sein Vater würde niemals seine Verlobung mit einem Mädchen billigen, das nicht die gleichen religiösen Überzeugungen wie ihre Familie teilt.	Sein Vater würde niemals seine Verlobung mit einem Mädchen billigen, das nicht die religiösen Überzeugungen seiner Familie teilte.	His father would never approve of his engagement to a girl who does not share the same religious beliefs as their family.	His father would never approve of his engagement to a girl who does not share the same religious beliefs as their family.	YES	YES
1985	n	Though Alfred is scrupulous in fulfilling his duties at work, he is less conscientious about his obligations at home.	Obwohl Alfred bei der Erfüllung seiner Pflichten bei der Arbeit gewissenhaft ist, ist er weniger sorgfältig in Bezug auf seine Verpflichtungen zu Hause.	Obwohl Alfred gewissenhaft seine Pflichten bei der Arbeit erfüllt, ist er weniger sorgfältig in Bezug auf seine Verpflichtungen zu Hause.	Obwohl Alfred penibel beim Erfüllen seiner Aufgaben bei der Arbeit ist, ist er weniger gewissenhaft bei seinen Pflichten zu Hause.	Although Alfred conscientiously fulfills his duties at work, he is less careful in regard to his obligations at home.	Although Alfred conscientiously fulfills his duties at work, he is less careful in regard to his obligations at home.	YES	YES
1992	n	Peter was an altruistic video game player; he would give items to people who needed them, rather than selling them for personal profit.	Peter war ein altruistischer Videospieler; er gab Gegenstände an Leute, die sie brauchten, anstatt sie für persönlichen Gewinn zu verkaufen.	Peter war ein altruistischer Videospieler; er würde Gegenstände an Leute geben, die sie brauchten, anstatt sie für persönlichen Gewinn zu verkaufen.	Peter war ein altruistischer Spieler; er gab Dinge an diejenigen weiter, die sie gebrauchen konnten, anstatt sie gewinnbringend zu verkaufen.	Peter was an altruistic video gamer; he would give items to people who needed them, instead of selling them for personal gain.	Peter was an altruistic video gamer; he would give items to people who needed them, instead of selling them for personal gain.	YES	YES
1997	e	Bill Clinton spoke in ambiguous language when asked to describe his relationship with Monica Lewinsky.	Bill Clinton sprach in zweideutiger Sprache, als er gebeten wurde, seine Beziehung zu Monica Lewinsky zu beschreiben.	Bill Clinton sprach in zweideutiger Sprache, als er gebeten wurde, seine Beziehung zu Monica Lewinsky zu beschreiben.	Bill Clinton sprach eine mehrdeutige Sprache, als er gebeten wurde, sein Verhältnis mit Monika Lewinsky zu beschreiben.	Bill Clinton spoke in ambiguous language when he was asked to describe his relationship with Monica Lewinsky.	Bill Clinton spoke in ambiguous language when he was asked to describe his relationship with Monica Lewinsky.	YES	YES
2000	n	The wealthy, self-indulgent young man felt oddly drawn to the strict, ascetic life led by members of some monastic orders.	Der wohlhabende, selbstgefällige junge Mann fühlte sich seltsamerweise von dem strengen, asketischen Leben angezogen, das von Mitgliedern einiger klösterlicher Orden geführt wurde.	Der wohlhabende, selbstsüchtige junge Mann fühlte sich merkwürdig zu dem strengen, asketischen Leben hingezogen, das von Mitgliedern einiger klösterlicher Orden geführt wurde.		The wealthy, selfish young man felt strangely drawn to the strict, ascetic life led by members of some monastic orders.	The wealthy, selfish young man felt strangely drawn to the strict, ascetic life led by members of some monastic orders.	YES	NO. The German translation of "self-indulgent" is not "selbstsüchtig" (selfish), but "genusssüchtig" or "luxusliebend". A better translation would be: "Der wohlhabende, genusssüchtige junge Mann fühlte sich merkwürdig zu dem strengen, asketischen Leben hingezogen, das von Mitgliedern einiger klösterlicher Orden geführt wurde."
2002	n	Baffled by Sherlock Holmes' cryptic remarks, Watson wondered whether Holmes was intentionally concealing his thoughts about the crime.	Verwirrt durch die kryptischen Bemerkungen von Sherlock Holmes, fragte sich Watson, ob Holmes absichtlich seine Gedanken über das Verbrechen verbarg.	Verwirrt von Sherlock Holmes' kryptischen Bemerkungen, fragte sich Watson, ob Holmes absichtlich seine Gedanken über das Verbrechen verbarg.	Verwirrt durch Sherlock Holmes rätselhafte Äußerungen, fragte sich Watson, ob Holmes absichtlich seine Überlegungen zu dem Verbrechen verheimlichte.	Confused by Sherlock Holmes' cryptic remarks, Watson wondered if Holmes was deliberately hiding his thoughts about the crime.	Confused by Sherlock Holmes' cryptic remarks, Watson wondered if Holmes was deliberately hiding his thoughts about the crime.	YES	YES
2004	e	Con artists take advantage of the credulity of inexperienced investors and swindle them out of their money.	Betrüger nutzen die Leichtgläubigkeit unerfahrener Anleger aus und betrügen sie um ihr Geld.	Betrüger nutzen die Leichtgläubigkeit unerfahrener Anleger aus und betrügen sie um ihr Geld.	Trickbetrüger machen sich die Leichtgläubigkeit unerfahrener Geldgeber zu Nutze und betrügen sie um ihr Geld.	Fraudsters exploit the gullibility of inexperienced investors and cheat them out of their money.	Fraudsters exploit the gullibility of inexperienced investors and cheat them out of their money.	YES	YES
2006	e	Even if your sentences were actually senseless, you at least have the luck to be able to form beautiful sentences.	Auch wenn deine Sätze tatsächlich sinnlos wären, hast du zumindest das Glück, schöne Sätze bilden zu können.	Auch wenn deine Sätze tatsächlich sinnlos wären, hast du zumindest das Glück, schöne Sätze bilden zu können.	Selbst wenn deine Sätze tatsächlich sinnfrei waren, hast du zumindest das Glück, schöne Sätze bilden zu können.	Even if your sentences were indeed meaningless, you at least have the luck to be able to form beautiful sentences.	Even if your sentences were indeed meaningless, you at least have the luck to be able to form beautiful sentences.	YES	YES
2008	e	Ray was willing to corroborate Gary's story, but the police were still unconvinced that either of them were telling the truth.	Ray war bereit, Garys Geschichte zu bestätigen, aber die Polizei war immer noch nicht überzeugt, dass einer von ihnen die Wahrheit sagte.	Ray war bereit, Garys Geschichte zu bestätigen, aber die Polizei war immer noch nicht überzeugt, dass einer von ihnen die Wahrheit sagte.	Ray war bereit, Garys Geschichte zu bestätigen, aber die Polizei war noch immer nicht überzeugt, dass einer von beiden die Wahrheit erzählte.	Ray war bereit, Garys Geschichte zu bestätigen, aber die Polizei war immer noch nicht überzeugt, dass einer von den beiden die Wahrheit erzählte.	Ray war bereit, Garys Geschichte zu bestätigen, aber die Polizei war immer noch nicht überzeugt, dass einer von den beiden die Wahrheit erzählte.	NO. The German translation is not completely accurate. The phrase "einer von ihnen" translates to "one of them", but the original English text says "either of them", which implies both of them. A better translation would be: "Ray war bereit, Garys Geschichte zu bestätigen, aber die Polizei war immer noch nicht überzeugt, dass beide die Wahrheit sagten."	NO. The German translation is not completely accurate. The phrase "einer von ihnen" translates to "one of them", but the original English text says "either of them", which implies both of them. A better translation would be: "Ray war bereit, Garys Geschichte zu bestätigen, aber die Polizei war immer noch nicht überzeugt, dass beide die Wahrheit sagten."
2011	e	There was a feeling of constraint in the room; no one dared to tell the king how foolish his decision was.	Es herrschte eine Atmosphäre der Zurückhaltung im Raum; niemand wagte es, dem König zu sagen, wie töricht seine Entscheidung war.	Es herrschte eine Atmosphäre der Zurückhaltung im Raum; niemand wagte es, dem König zu sagen, wie töricht seine Entscheidung war.	Im Raum war eine zurückhaltende Stimmung; niemand wagte, dem König zu sagen, wie unklug seine Entscheidung war.	There was an atmosphere of restraint in the room; no one dared to tell the king how foolish his decision was.	There was an atmosphere of restraint in the room; no one dared to tell the king how foolish his decision was.	YES	YES
2014	n	Even though he had served his time in prison, the murderer was never quite condoned by the public for his crime.	Obwohl er seine Zeit im Gefängnis abgesessen hatte, wurde der Mörder von der Öffentlichkeit nie ganz für seine Tat begnadigt.	Obwohl er seine Zeit im Gefängnis abgesessen hatte, wurde der Mörder von der Öffentlichkeit für sein Verbrechen nie ganz gebilligt.	Obwohl er seine Haftstrafe im Gefängnis abgesessen hatte, verzieh die Öffentlichkeit dem Mörder sein Verbrechen nie ganz.	Although he had served his time in prison, the murderer was never fully approved by the public for his crime.	Although he had served his time in prison, the murderer was never fully approved by the public for his crime.	NO. The German translation is not entirely correct. The word "begnadigt" means "pardoned", which is not the same as "condoned". A better translation would be: "Obwohl er seine Zeit im Gefängnis abgesessen hatte, wurde dem Mörder seine Tat von der Öffentlichkeit nie ganz verziehen."	YES
2021	n	The depravity of the king's deeds led the people to believe he was nothing more than a tyrant that needed to be overthrown.	Die Verderbtheit der Taten des Königs ließ das Volk glauben, dass er nichts weiter als ein Tyrann war, der gestürzt werden musste.	Die Verderbtheit der Taten des Königs ließ das Volk glauben, er sei nichts weiter als ein Tyrann, der gestürzt werden musste.	Die Verderbtheit der Taten des Königs brachte die Leute dazu, zu glauben, dass er nicht mehr als eine Tyrann sei, den man stürzen müsse.	The corruption of the king's actions led the people to believe that he was nothing more than a tyrant who needed to be overthrown.	The corruption of the king's actions led the people to believe that he was nothing more than a tyrant who needed to be overthrown.	YES	YES
2070	e	Sadly many people will believe things told to them via an email which they would find implausible face-to-face.	Leider glauben viele Menschen Dingen, die ihnen per E-Mail mitgeteilt werden, die sie von Angesicht zu Angesicht unglaubwürdig finden würden.	Leider glauben viele Menschen Dingen, die ihnen per E-Mail mitgeteilt werden, die sie von Angesicht zu Angesicht unglaubwürdig finden würden.	Leider würden viele Leute Dinge glauben, die man ihnen per E-Mail sagt, die sie persönlich erzählt nicht plausibel finden würden.	Unfortunately, many people believe things that are communicated to them via email, which they would find unbelievable face to face.	Unfortunately, many people believe things that are communicated to them via email, which they would find unbelievable face to face.	YES	YES
2072	n	The police are really good at understanding "Someone stole my credit card and ran up a lot of charges." It's a lot harder to get them to buy into "Someone stole my magic sword."	Die Polizei versteht sehr gut, wenn jemand meine Kreditkarte gestohlen und viele Kosten verursacht hat. Es ist viel schwieriger, sie davon zu überzeugen, dass jemand mein magisches Schwert gestohlen hat.	Die Polizei ist wirklich gut darin zu verstehen, wenn jemand sagt Jemand hat meine Kreditkarte gestohlen und viele Kosten verursacht. Es ist viel schwieriger, sie davon zu überzeugen, dass Jemand mein magisches Schwert gestohlen hat.	Die Polizei ist gut darin zu verstehen, dass jemand meine Kreditkarte gestohlen hat und viel Geld abgehoben hat. Es ist viel schwieriger, ihnen beizubringen, dass „jemand mein magisches Schwert gestohlen“ hat.	The police are really good at understanding when someone says someone has stolen my credit card and caused a lot of charges. It's much harder to convince them that someone has stolen my magical sword.	The police are really good at understanding when someone says someone has stolen my credit card and caused a lot of charges. It's much harder to convince them that someone has stolen my magical sword.	YES	YES
